{
  "GeneralInformation": {
    "NumberOfStories": 1,
    "YearBuilt": 1900,
    "StructureType": "C1",
    "OccupancyClass": "EDU1",
    "units": {
      "force": "kips",
      "length": "ft",
      "time": "sec"
    },
    "DesignLevel": "LC",
    "BuildingRise": "L"
  },
  "assetType": "Buildings",
  "Applications": {
    "DL": {
      "ApplicationData": {
        "ground_failure": false
      }
    }
  },
  "DL": {
    "Asset": {
      "ComponentAssignmentFile": "CMP_QNT.csv",
      "ComponentDatabase": "Hazus Earthquake - Buildings",
      "NumberOfStories": "1",
      "OccupancyType": "EDU1",
      "PlanArea": "1"
    },
    "Damage": {
      "DamageProcess": "Hazus Earthquake",
      "ScalingSpecification": {"LF.C1.L.LC-1-1":{"LS1": "*1.2"}, "collapse-0-1": {"ALL": "*1.2"}}
    },
    "Demands": {
      "DemandFilePath": "response.csv",
      "SampleSize": "100",
      "CoupledDemands": true
    },
    "Losses": {
      "Repair": {
        "ConsequenceDatabase": "Hazus Earthquake - Buildings",
        "MapApproach": "Automatic"
      }
    },
    "Options": {
      "NonDirectionalMultipliers": {
        "ALL": 1.0
      }
    },
    "Outputs": {
      "Demand": {
        "Sample": true,
        "Statistics": false
      },
      "Asset": {
        "Sample": true,
        "Statistics": false
      },
      "Damage": {
        "Sample": false,
        "Statistics": false,
        "GroupedSample": true,
        "GroupedStatistics": true
      },
      "Loss": {
        "Repair": {
          "Sample": true,
          "Statistics": true,
          "GroupedSample": true,
          "GroupedStatistics": false,
          "AggregateSample": true,
          "AggregateStatistics": true
        }
      },
      "Format": {
        "CSV": false,
        "JSON": true
      },
      "Settings": {
        "CondenseDS": true,
        "SimpleIndexInJSON": true,
        "AggregateColocatedComponentResults": true
      }
    }
  }
}
